{
  "$schema": "https://json-schema.org/draft/2020-12/schema",
  "$id": "https://github.com/anagnorisis2peripeteia/stryker-cxx/schemas/stryker-cxx.config.schema.json",
  "title": "stryker-cxx config",
  "type": "object",
  "additionalProperties": false,
  "properties": {
    "schemaVersion": { "const": "stryker-cxx.config.v1" },
    "base": { "type": "string" },
    "since": { "type": "string" },
    "files": {
      "oneOf": [
        { "type": "string" },
        {
          "type": "object",
          "additionalProperties": false,
          "properties": {
            "include": { "type": "array", "items": { "type": "string" } },
            "exclude": { "type": "array", "items": { "type": "string" } }
          }
        }
      ]
    },
    "mutators": {
      "oneOf": [
        { "type": "string" },
        { "type": "array", "items": { "type": "string" } },
        {
          "type": "object",
          "additionalProperties": false,
          "properties": {
            "enabled": { "type": "array", "items": { "type": "string" } }
          }
        }
      ]
    },
    "mutationLevel": { "enum": ["Standard", "Advanced", "Complete"] },
    "thresholds": {
      "type": "object",
      "additionalProperties": false,
      "properties": {
        "high": { "type": "number", "minimum": 0, "maximum": 1 },
        "low": { "type": "number", "minimum": 0, "maximum": 1 },
        "break": { "type": "number", "minimum": 0, "maximum": 1 }
      }
    },
    "execution": {
      "type": "object",
      "additionalProperties": false,
      "properties": {
        "buildCommand": { "type": "string" },
        "checkCommand": { "type": "string" },
        "checkSystem": { "enum": ["clang", "clang++", "clang-tidy", "cppcheck"] },
        "checkArgs": { "type": "string" },
        "testCommand": { "type": "string" },
        "buildSystem": { "enum": ["cmake", "ctest", "ninja", "make", "meson", "bazel", "xcodebuild"] },
        "buildDir": { "type": "string" },
        "buildTarget": { "type": "string" },
        "artifactPath": { "type": "string" },
        "xcodeWorkspace": { "type": "string" },
        "xcodeProject": { "type": "string" },
        "xcodeScheme": { "type": "string" },
        "xcodeConfiguration": { "type": "string" },
        "xcodeSdk": { "type": "string" },
        "xcodeDestination": { "type": "string" },
        "testTarget": { "type": "string" },
        "testFilter": { "type": "string" },
        "testFramework": { "enum": ["gtest", "googletest", "catch2", "doctest", "xctest"] },
        "testBinary": { "type": "string" },
        "xctestBundle": { "type": "string" },
        "xctestDestination": { "type": "string" },
        "xctestOnlyTesting": {
          "oneOf": [
            { "type": "string" },
            { "type": "array", "items": { "type": "string" } }
          ]
        },
        "xctestSkipTesting": {
          "oneOf": [
            { "type": "string" },
            { "type": "array", "items": { "type": "string" } }
          ]
        },
        "maxMutants": { "type": "integer", "minimum": 1 },
        "includeMetal": { "type": "boolean" },
        "mutators": {},
        "mutationLevel": { "enum": ["Standard", "Advanced", "Complete"] },
        "threshold": { "type": "number", "minimum": 0, "maximum": 1 },
        "thresholdHigh": { "type": "number", "minimum": 0, "maximum": 1 },
        "thresholdLow": { "type": "number", "minimum": 0, "maximum": 1 },
        "thresholdBreak": { "type": "number", "minimum": 0, "maximum": 1 },
        "timeoutSeconds": { "type": "integer", "minimum": 1 },
        "timeoutFactor": { "type": "number", "minimum": 0 },
        "timeoutConstantMs": { "type": "integer", "minimum": 0 },
        "artifactDir": { "type": "string" },
        "artifactBackend": { "enum": ["source-overlay", "compiled-executable", "compiled-library", "compiled-object"] },
        "artifactFallback": { "enum": ["none", "source-overlay"] },
        "retainWorktrees": { "type": "boolean" },
        "retainWorktreesFor": {
          "oneOf": [
            {
              "type": "string",
              "pattern": "^(ALL|NONE|KILLED|SURVIVED|BUILD_ERROR|CHECK_ERROR|NO_COVERAGE|TIMEOUT|IGNORED|RUNTIME_ERROR|PENDING)(,(ALL|NONE|KILLED|SURVIVED|BUILD_ERROR|CHECK_ERROR|NO_COVERAGE|TIMEOUT|IGNORED|RUNTIME_ERROR|PENDING))*$"
            },
            {
              "type": "array",
              "items": {
                "enum": [
                  "ALL",
                  "NONE",
                  "KILLED",
                  "SURVIVED",
                  "BUILD_ERROR",
                  "CHECK_ERROR",
                  "NO_COVERAGE",
                  "TIMEOUT",
                  "IGNORED",
                  "RUNTIME_ERROR",
                  "PENDING"
                ]
              }
            }
          ]
        },
        "retainedWorktreeTtlHours": {
          "oneOf": [
            { "type": "number", "minimum": 0 },
            { "type": "null" }
          ]
        },
        "workerTmpDir": { "type": "string" },
        "workerLabel": { "type": "string" },
        "env": {
          "oneOf": [
            { "type": "object", "additionalProperties": { "type": "string" } },
            { "type": "array", "items": { "type": "string", "pattern": "^[^=]+=.*$" } }
          ]
        },
        "envInherit": {
          "oneOf": [
            { "type": "string" },
            { "type": "array", "items": { "type": "string" } }
          ]
        },
        "envBlock": {
          "oneOf": [
            { "type": "string" },
            { "type": "array", "items": { "type": "string" } }
          ]
        },
        "mode": { "enum": ["token", "clang", "clang-ast"] },
        "executionMode": { "enum": ["source-overlay", "mutant-switch"] },
        "executionBackend": { "enum": ["auto", "source-overlay", "mutant-switch", "compiled-artifact", "llvm-switch"] },
        "jobs": { "type": "integer", "minimum": 1 },
        "batchMutants": { "type": "boolean" },
        "batchSize": { "type": "integer", "minimum": 1 },
        "worktreeMode": { "enum": ["inplace", "copy", "git-worktree"] },
        "format": { "enum": ["json", "markdown", "html", "sarif", "github-annotations", "mutation-testing-elements"] },
        "outputFormat": { "enum": ["legacy", "stryker-cxx"] },
        "skipInitialTest": { "type": "boolean" },
        "initialTest": { "type": "boolean" },
        "dryRunOnly": { "type": "boolean" },
        "skipTests": { "type": "boolean" },
        "coverageFile": { "type": "string" },
        "coverageAnalysis": { "enum": ["off", "all", "perTest", "perTestInIsolation"] },
        "coverageProvider": { "type": "string" },
        "coverageTestCommandTemplate": { "type": "string" },
        "coverageHelperCommandTemplate": { "type": "string" },
        "coverageHelperTests": {
          "oneOf": [
            { "type": "string" },
            { "type": "array", "items": { "type": "string" } }
          ]
        },
        "equivalentSuppression": { "enum": ["off", "conservative", "aggressive"] },
        "plugins": { "type": "array", "items": { "type": "string" } },
        "pluginDirs": { "type": "array", "items": { "type": "string" } },
        "reporters": { "type": "array", "items": { "type": "string" } },
        "dashboardExport": { "type": "string" },
        "dashboardUploadUrl": { "type": "string", "format": "uri" },
        "dashboardVersion": { "type": "string" },
        "dashboardProject": { "type": "string" },
        "dashboardBranch": { "type": "string" },
        "dashboardCommit": { "type": "string" },
        "dashboardBuildUrl": { "type": "string" },
        "dashboardRetentionDays": {
          "oneOf": [
            { "type": "integer", "minimum": 1 },
            { "type": "null" }
          ]
        },
        "dashboardAuthTokenEnv": { "type": "string" },
        "dashboardAuthHeader": { "type": "string" },
        "dashboardUploadRetries": { "type": "integer", "minimum": 0 },
        "dashboardUploadRetryDelayMs": { "type": "integer", "minimum": 0 },
        "distributionManifest": { "type": "string" },
        "incremental": { "type": "boolean" },
        "baselineFile": { "type": "string" },
        "baselineMaxAgeDays": { "type": "integer", "minimum": 1 },
        "baselineBranch": { "type": "string" },
        "writeBaseline": { "type": "string" },
        "clearBaseline": { "type": "boolean" }
      }
    },
    "mutationArtifact": {
      "type": "object",
      "additionalProperties": false,
      "properties": {
        "backend": { "enum": ["source-overlay", "compiled-executable", "compiled-library", "compiled-object"] },
        "fallback": { "enum": ["none", "source-overlay"] },
        "retainArtifactsFor": {
          "oneOf": [
            { "type": "string" },
            { "type": "array", "items": { "type": "string" } }
          ]
        }
      }
    },
    "report": {
      "type": "object",
      "additionalProperties": false,
      "properties": {
        "threshold": { "type": "number", "minimum": 0, "maximum": 1 },
        "thresholdBreak": { "type": "number", "minimum": 0, "maximum": 1 },
        "failOnEmpty": { "type": "boolean" },
        "fail_on_empty": { "type": "boolean" }
      }
    },
    "coverageFile": { "type": "string" },
    "coverageAnalysis": { "enum": ["off", "all", "perTest", "perTestInIsolation"] },
    "executionBackend": { "enum": ["auto", "source-overlay", "mutant-switch", "compiled-artifact", "llvm-switch"] },
    "coverageProvider": { "type": "string" },
    "coverageHelperCommandTemplate": { "type": "string" },
    "coverageHelperTests": {
      "oneOf": [
        { "type": "string" },
        { "type": "array", "items": { "type": "string" } }
      ]
    },
    "baselineFile": { "type": "string" },
    "writeBaseline": { "type": "string" },
    "plugins": { "type": "array", "items": { "type": "string" } },
    "pluginDirs": { "type": "array", "items": { "type": "string" } }
  }
}
