{
  "schemaVersion": "stryker-cxx.config.v1",
  "files": {
    "include": ["src/**/*.cpp"],
    "exclude": ["**/test/**"]
  },
  "mutators": ["ConditionalBoundary", "EqualityOperator"],
  "thresholds": {
    "high": 0.9,
    "low": 0.7,
    "break": 0.6
  },
  "execution": {
    "buildSystem": "cmake",
    "buildDir": "build",
    "artifactPath": "",
    "xcodeWorkspace": "Example.xcworkspace",
    "xcodeScheme": "ExampleTests",
    "xcodeConfiguration": "Debug",
    "xcodeSdk": "iphonesimulator",
    "xcodeDestination": "platform=iOS Simulator,name=iPhone 15",
    "checkSystem": "clang-tidy",
    "checkArgs": "--checks=-*,bugprone-*",
    "xctestDestination": "platform=iOS Simulator,name=iPhone 15",
    "xctestOnlyTesting": ["MathFixtureTests/testAdd"],
    "xctestSkipTesting": ["MathFixtureTests/testSlow"],
    "dashboardUploadRetries": 1,
    "dashboardUploadRetryDelayMs": 0,
    "mode": "token",
    "executionMode": "source-overlay",
    "worktreeMode": "copy",
    "jobs": 1,
    "retainWorktreesFor": ["SURVIVED", "TIMEOUT"],
    "retainedWorktreeTtlHours": 24,
    "workerLabel": "pr-96205-proof",
    "envInherit": ["PATH", "HOME"],
    "envBlock": ["GITHUB_TOKEN"],
    "coverageHelperCommandTemplate": "run-one-test {test} --coverage-out {coverage_file}",
    "coverageHelperTests": ["MathFixtureTests/testAdd"],
    "equivalentSuppression": "conservative",
    "dashboardVersion": "1",
    "dashboardRetentionDays": 14,
    "dashboardProject": "example/project",
    "dashboardBranch": "main",
    "dashboardCommit": "abc123",
    "dashboardBuildUrl": "https://ci.example/build/123",
    "dashboardAuthTokenEnv": "STRYKER_CXX_DASHBOARD_TOKEN",
    "dashboardAuthHeader": "Authorization",
    "timeoutFactor": 1.5,
    "timeoutConstantMs": 5000,
    "incremental": false,
    "baselineMaxAgeDays": 7,
    "baselineBranch": "main"
  },
  "report": {
    "failOnEmpty": true
  }
}
